Document,Domain,Key_Aspects
Employment Agreement,Agriculture,"Hiring Process for Farm Workers, Employee Responsibilities, Compensation and Benefits, Non-Compete Agreements, Confidentiality Obligations"
Equipment Lease Agreement,Agriculture,"Leasing of Farming Equipment, Facilities Management Contracts, Temporary Equipment Arrangements"
Independent Contractor Agreement,Agriculture,"Hiring of Independent Contractors for Farming Projects, Consultation Services, Temporary Staffing Arrangements"
Joint Venture Agreement,Agriculture,"Development Projects, Revenue Sharing Arrangements, Governance Structure, Decision-Making Processes, Exit Strategies"
Lease Agreement,Agriculture,"Leasing of Agricultural Land, Rental Contracts for Farms, Leasing of Land for Agricultural Purposes"
Maintenance Agreement,Agriculture,"Maintenance Services for Farming Equipment, Facility Maintenance Contracts, Service Agreements for Farms"
Memorandum of Understanding (MOU),Agriculture,"Preliminary Agreements, Intentions for Collaborative Projects, Frameworks for Joint Ventures"
Non-Compete Agreement,Agriculture,"Restricting Competition Among Agricultural Companies, Non-Compete Clauses in Employment Contracts, Protection of Intellectual Property"
Non-Disclosure Agreement (NDA),Agriculture,"Protection of Intellectual Property, Technology Assessment, Compliance and Regulatory Requirements, Vendor Selection Process, Partnership Discussions"
Partnership Agreement,Agriculture,"Revenue Sharing Arrangements, Governance Structure, Decision-Making Processes, Roles and Responsibilities, Dispute Resolution Mechanisms"
Purchase Agreement,Agriculture,"Procurement of Agricultural Products, Purchase of Farming Supplies, Acquisition of Agricultural Businesses or Assets"
Reseller Agreement,Agriculture,"Distribution Agreements for Agricultural Products, Reselling Farming Services or Products, Partnerships with Distributors"
Service Agreement,Agriculture,"Service Level Agreements for Farming Services, Scope of Services, Pricing Structure, Performance Metrics"
Supplier Agreement,Agriculture,"Quality Standards for Agricultural Products, Delivery Schedules, Pricing Structure, Payment Terms, Product Specifications"
Vendor Agreement,Agriculture,"Service Level Agreements with Vendors, Pricing Structure, Performance Metrics, Termination Conditions"
RFI,Agriculture,"Vendor Selection Process, Technology Assessment, Compliance and Regulatory Requirements, Market Research, Partnership Discussions, Risk Management"
RFQ,Agriculture,"Vendor Selection Process, Pricing Comparison, Budget Planning, Supplier Evaluation, Product or Service Specifications, Risk Management"
RFP,Agriculture,"Vendor Selection Process, Project Scope and Objectives, Budget Planning, Service Level Agreements, Deliverables, Risk Management"
Collaboration Agreement,Biotechnology and Pharmaceuticals,"Partnerships with Research Institutions, Joint Research and Development Projects, Collaborative Pharmaceutical Programs"
Confidentiality Agreement (NDA),Biotechnology and Pharmaceuticals,"Protection of Intellectual Property, Technology Assessment, Compliance and Regulatory Requirements, Vendor Selection Process, Partnership Discussions"
Consulting Agreement,Biotechnology and Pharmaceuticals,"Consulting Services for Pharmaceutical Operations, Technology Assessment, Compliance and Regulatory Requirements, Service Level Agreements"
Distribution Agreement,Biotechnology and Pharmaceuticals,"Product Distribution Strategies, Geographic Reach, Revenue Sharing Arrangements, Performance Metrics"
Employment Agreement,Biotechnology and Pharmaceuticals,"Hiring Process for Pharmaceutical Workers, Employee Responsibilities, Compensation and Benefits, Non-Compete Agreements, Confidentiality Obligations"
Equipment Lease Agreement,Biotechnology and Pharmaceuticals,"Leasing of Laboratory Equipment, Facilities Management Contracts, Temporary Equipment Arrangements"
Franchise Agreement,Biotechnology and Pharmaceuticals,"Franchising Pharmaceutical Services, Licensing of Pharmaceutical Brands"
Independent Contractor Agreement,Biotechnology and Pharmaceuticals,"Hiring of Independent Contractors for Pharmaceutical Projects, Consultation Services, Temporary Staffing Arrangements"
Joint Venture Agreement,Biotechnology and Pharmaceuticals,"Development Projects, Revenue Sharing Arrangements, Governance Structure, Decision-Making Processes, Exit Strategies"
Licensing Agreement,Biotechnology and Pharmaceuticals,"Intellectual Property Rights Licensing, Technology Transfer, Usage Restrictions, Royalty Payments"
Loan Agreement,Biotechnology and Pharmaceuticals,"Financing for Pharmaceutical Operations, Research and Development Projects, Acquisition of Laboratory Equipment, Operating Capital for Pharmaceutical Companies"
Maintenance Agreement,Biotechnology and Pharmaceuticals,"Maintenance Services for Laboratory Equipment, Facility Maintenance Contracts, Service Agreements for Laboratories"
Manufacturing Agreement,Biotechnology and Pharmaceuticals,"Outsourcing of Pharmaceutical Manufacturing, Production Contracts for Pharmaceuticals, Supply Chain Agreements"
Memorandum of Understanding (MOU),Biotechnology and Pharmaceuticals,"Preliminary Agreements, Intentions for Collaborative Projects, Frameworks for Joint Ventures"
Non-Compete Agreement,Biotechnology and Pharmaceuticals,"Restricting Competition Among Pharmaceutical Companies, Non-Compete Clauses in Employment Contracts, Protection of Intellectual Property"
Non-Disclosure Agreement (NDA),Biotechnology and Pharmaceuticals,"Protection of Intellectual Property, Technology Assessment, Compliance and Regulatory Requirements, Vendor Selection Process, Partnership Discussions"
Partnership Agreement,Biotechnology and Pharmaceuticals,"Revenue Sharing Arrangements, Governance Structure, Decision-Making Processes, Roles and Responsibilities, Dispute Resolution Mechanisms"
Purchase Agreement,Biotechnology and Pharmaceuticals,"Procurement of Pharmaceutical Products, Purchase of Laboratory Supplies, Acquisition of Pharmaceutical Businesses or Assets"
Reseller Agreement,Biotechnology and Pharmaceuticals,"Distribution Agreements for Pharmaceutical Products, Reselling Pharmaceutical Services or Products, Partnerships with Distributors"
Service Agreement,Biotechnology and Pharmaceuticals,"Service Level Agreements for Pharmaceutical Services, Scope of Services, Pricing Structure, Performance Metrics"
Supplier Agreement,Biotechnology and Pharmaceuticals,"Quality Standards for Pharmaceutical Products, Delivery Schedules, Pricing Structure, Payment Terms, Product Specifications"
Vendor Agreement,Biotechnology and Pharmaceuticals,"Service Level Agreements with Vendors, Pricing Structure, Performance Metrics, Termination Conditions"
RFI,Biotechnology and Pharmaceuticals,"Vendor Selection Process, Technology Assessment, Compliance and Regulatory Requirements, Market Research, Partnership Discussions, Risk Management"
RFQ,Biotechnology and Pharmaceuticals,"Vendor Selection Process, Pricing Comparison, Budget Planning, Supplier Evaluation, Product or Service Specifications, Risk Management"
RFP,Biotechnology and Pharmaceuticals,"Vendor Selection Process, Project Scope and Objectives, Budget Planning, Service Level Agreements, Deliverables, Risk Management"
