Document,Domain,Key_Aspects
Agency Agreement,Fintech,"Partnerships and Collaborations, Marketing Strategies, Revenue Sharing Arrangements, Performance Metrics, Service Level Agreements, Termination Conditions"
Affiliate Agreement,Fintech,"Revenue Sharing Arrangements, Marketing Strategies, Compliance and Regulatory Requirements, Performance Metrics, Termination Conditions, Intellectual Property Rights"
Confidentiality Agreement (NDA),Fintech,"Partnerships and Collaborations, Vendor Selection Process, Technology Assessment, Compliance and Regulatory Requirements, Intellectual Property Protection, Investor Discussions"
Consulting Agreement,Fintech,"Technology Assessment, Compliance and Regulatory Requirements, Service Level Agreements, Project Scope and Objectives, Deliverables, Compensation Terms"
Distribution Agreement,Fintech,"Marketing Strategies, Geographic Reach, Revenue Sharing Arrangements, Performance Metrics, Termination Conditions, Exclusive Rights"
Employment Agreement,Fintech,"Hiring Process, Employee Responsibilities, Compensation and Benefits, Non-Compete Agreements, Confidentiality Obligations, Termination Conditions"
Joint Venture Agreement,Fintech,"Project Scope and Objectives, Revenue Sharing Arrangements, Governance Structure, Decision-Making Processes, Exit Strategies, Intellectual Property Rights"
Licensing Agreement,Fintech,"Intellectual Property Rights, Technology Transfer, Usage Restrictions, Royalty Payments, Compliance and Regulatory Requirements, Termination Conditions"
Loan Agreement,Fintech,"Loan Terms and Conditions, Interest Rates, Repayment Schedules, Collateral Requirements, Default Provisions, Prepayment Penalties"
Non-Disclosure Agreement (NDA),Fintech,"Technology Assessment, Compliance and Regulatory Requirements, Intellectual Property Protection, Vendor Selection Process, Investor Discussions, Partnership Discussions"
Partnership Agreement,Fintech,"Revenue Sharing Arrangements, Governance Structure, Decision-Making Processes, Roles and Responsibilities, Dispute Resolution Mechanisms, Exit Strategies"
Service Agreement,Fintech,"Service Level Agreements, Scope of Services, Pricing Structure, Performance Metrics, Termination Conditions, Intellectual Property Rights"
Shareholder Agreement,Fintech,"Equity Ownership, Voting Rights, Dividend Distribution, Board Representation, Transfer Restrictions, Exit Strategies"
Supplier Agreement,Fintech,"Quality Standards, Delivery Schedules, Pricing Structure, Payment Terms, Product Specifications, Termination Conditions"
Vendor Agreement,Fintech,"Service Level Agreements, Pricing Structure, Performance Metrics, Termination Conditions, Delivery Schedules, Intellectual Property Rights"
RFI (Request for Information),Fintech,"Vendor Selection Process, Technology Assessment, Compliance and Regulatory Requirements, Market Research, Partnership Discussions, Risk Management"
RFQ (Request for Quotation),Fintech,"Vendor Selection Process, Pricing Comparison, Budget Planning, Supplier Evaluation, Product or Service Specifications, Risk Management"
RFP (Request for Proposal),Fintech,"Vendor Selection Process, Project Scope and Objectives, Budget Planning, Service Level Agreements, Deliverables, Risk Management"
Advertising Agreement,Healthcare,"Marketing Strategies, Promotion of Healthcare Services, Advertising Campaigns, Branding Initiatives, Sponsorship Agreements"
Barter Agreement,Healthcare,"Procurement of Goods or Services in Exchange for Healthcare Products or Services, Partnerships with Suppliers, Bartering Medical Equipment or Supplies"
Bill of Sale,Healthcare,"Transfer of Ownership of Healthcare Equipment or Supplies, Purchase of Medical Devices, Transaction Records for Healthcare Assets"
Business Loan Agreement,Healthcare,"Financing for Healthcare Facilities, Expansion Projects, Acquisition of Medical Equipment, Operating Capital for Healthcare Providers"
Collaboration Agreement,Healthcare,"Partnerships with Research Institutions, Joint Research and Development Projects, Collaborative Healthcare Programs, Alliances with Pharmaceutical Companies"
Equipment Lease Agreement,Healthcare,"Leasing Medical Equipment, Facilities Management Contracts, Temporary Equipment Arrangements for Healthcare Providers"
Franchise Agreement,Healthcare,"Franchising Healthcare Services, Licensing of Healthcare Brands, Expansion of Healthcare Clinics or Facilities"
Independent Contractor Agreement,Healthcare,"Hiring of Independent Healthcare Professionals, Consultation Services, Temporary Staffing Arrangements"
Lease Agreement,Healthcare,"Leasing Healthcare Facilities, Rental Contracts for Medical Offices, Leasing of Land for Hospital Construction"
Maintenance Agreement,Healthcare,"Maintenance Services for Medical Equipment, Facility Maintenance Contracts, Service Agreements for Healthcare Facilities"
Manufacturing Agreement,Healthcare,"Outsourcing of Medical Device Manufacturing, Production Contracts for Pharmaceuticals, Supply Chain Agreements"
Memorandum of Understanding (MOU),Healthcare,"Preliminary Agreements for Healthcare Partnerships, Intentions for Collaborative Projects, Frameworks for Joint Ventures"
Non-Compete Agreement,Healthcare,"Restricting Competition Among Healthcare Professionals, Non-Compete Clauses in Employment Contracts, Protection of Intellectual Property"
Purchase Agreement,Healthcare,"Procurement of Medical Supplies, Purchase of Pharmaceuticals, Acquisition of Healthcare Businesses or Assets"
Reseller Agreement,Healthcare,"Distribution Agreements for Medical Products, Reselling Healthcare Services, Partnerships with Distributors"
Sublease Agreement,Healthcare,"Subleasing of Healthcare Facilities or Office Spaces, Subcontracting Services, Rental Agreements for Healthcare Providers"
Advertising Agreement,E-commerce,"Marketing Strategies, Promotion of Products or Services, Advertising Campaigns, Branding Initiatives, Sponsorship Agreements"
Affiliate Agreement,E-commerce,"Affiliate Partnerships, Revenue Sharing Arrangements, Marketing Strategies, Compliance and Regulatory Requirements, Performance Metrics, Termination Conditions, Intellectual Property Rights"
Barter Agreement,E-commerce,"Exchange of Goods or Services, Partnerships with Suppliers, Bartering Product or Service Offerings"
Business Loan Agreement,E-commerce,"Financing for E-commerce Ventures, Expansion Projects, Acquisition of Inventory or Equipment, Operating Capital for E-commerce Businesses"
Collaboration Agreement,E-commerce,"Partnerships with Other E-commerce Businesses, Joint Ventures, Collaborative Marketing Campaigns, Product Development Projects"
Confidentiality Agreement (NDA),E-commerce,"Protection of Intellectual Property, Vendor Selection Process, Technology Assessment, Compliance and Regulatory Requirements, Investor Discussions, Partnership Discussions"
Distribution Agreement,E-commerce,"Product Distribution Strategies, Geographic Reach, Revenue Sharing Arrangements, Performance Metrics, Termination Conditions, Exclusive Rights"
Employment Agreement,E-commerce,"Hiring Process, Employee Responsibilities, Compensation and Benefits, Non-Compete Agreements, Confidentiality Obligations, Termination Conditions"
Equipment Lease Agreement,E-commerce,"Leasing of Equipment for E-commerce Operations, Facilities Management Contracts, Temporary Equipment Arrangements"
Franchise Agreement,E-commerce,"Franchising E-commerce Services, Licensing of E-commerce Brands, Expansion of E-commerce Platforms"
Independent Contractor Agreement,E-commerce,"Hiring of Independent Contractors for E-commerce Projects, Consultation Services, Temporary Staffing Arrangements"
Lease Agreement,E-commerce,"Leasing of Warehouses or Storage Facilities, Rental Contracts for Office Spaces, Leasing of Land for E-commerce Operations"
Manufacturing Agreement,E-commerce,"Outsourcing of Product Manufacturing, Production Contracts for E-commerce Products, Supply Chain Agreements"
Memorandum of Understanding (MOU),E-commerce,"Preliminary Agreements for E-commerce Partnerships, Intentions for Collaborative Projects, Frameworks for Joint Ventures"
Non-Disclosure Agreement (NDA),E-commerce,"Protection of Intellectual Property, Technology Assessment, Compliance and Regulatory Requirements, Vendor Selection Process, Investor Discussions, Partnership Discussions"
Partnership Agreement,E-commerce,"Revenue Sharing Arrangements, Governance Structure, Decision-Making Processes, Roles and Responsibilities, Dispute Resolution Mechanisms, Exit Strategies"
Purchase Agreement,E-commerce,"Procurement of Inventory, Purchase of Goods or Services, Acquisition of E-commerce Businesses or Assets"
Reseller Agreement,E-commerce,"Distribution Agreements for E-commerce Products, Reselling E-commerce Services, Partnerships with Distributors"
Service Agreement,E-commerce,"Service Level Agreements, Scope of Services, Pricing Structure, Performance Metrics, Termination Conditions, Intellectual Property Rights"
Supplier Agreement,E-commerce,"Quality Standards, Delivery Schedules, Pricing Structure, Payment Terms, Product Specifications, Termination Conditions"
Vendor Agreement,E-commerce,"Service Level Agreements, Pricing Structure, Performance Metrics, Termination Conditions, Delivery Schedules, Intellectual Property Rights"
RFI (Request for Information),E-commerce,"Vendor Selection Process, Technology Assessment, Compliance and Regulatory Requirements, Market Research, Partnership Discussions, Risk Management"
RFQ (Request for Quotation),E-commerce,"Vendor Selection Process, Pricing Comparison, Budget Planning, Supplier Evaluation, Product or Service Specifications, Risk Management"
RFP (Request for Proposal),E-commerce,"Vendor Selection Process, Project Scope and Objectives, Budget Planning, Service Level Agreements, Deliverables, Risk Management"
Document,Domain,Key_Aspects
Advertising Agreement,Telecommunications,"Marketing Strategies, Promotion of Telecommunication Services, Advertising Campaigns, Branding Initiatives, Sponsorship Agreements"
Collaboration Agreement,Telecommunications,"Partnerships with Other Telecommunications Companies, Joint Ventures, Collaborative Marketing Campaigns, Product Development Projects"
Confidentiality Agreement (NDA),Telecommunications,"Protection of Intellectual Property, Technology Assessment, Compliance and Regulatory Requirements, Vendor Selection Process, Investor Discussions, Partnership Discussions"
Consulting Agreement,Telecommunications,"Technology Assessment, Compliance and Regulatory Requirements, Service Level Agreements, Project Scope and Objectives, Deliverables, Compensation Terms"
Distribution Agreement,Telecommunications,"Product Distribution Strategies, Geographic Reach, Revenue Sharing Arrangements, Performance Metrics, Termination Conditions, Exclusive Rights"
Employment Agreement,Telecommunications,"Hiring Process, Employee Responsibilities, Compensation and Benefits, Non-Compete Agreements, Confidentiality Obligations, Termination Conditions"
Equipment Lease Agreement,Telecommunications,"Leasing of Telecommunication Equipment, Facilities Management Contracts, Temporary Equipment Arrangements"
Franchise Agreement,Telecommunications,"Franchising Telecommunication Services, Licensing of Telecommunication Brands, Expansion of Telecommunication Platforms"
Independent Contractor Agreement,Telecommunications,"Hiring of Independent Contractors for Telecommunications Projects, Consultation Services, Temporary Staffing Arrangements"
Joint Venture Agreement,Telecommunications,"Project Scope and Objectives, Revenue Sharing Arrangements, Governance Structure, Decision-Making Processes, Exit Strategies, Intellectual Property Rights"
Lease Agreement,Telecommunications,"Leasing of Telecommunication Facilities, Rental Contracts for Telecommunication Offices, Leasing of Land for Telecommunication Infrastructure"
Licensing Agreement,Telecommunications,"Licensing of Telecommunication Technologies, Usage Restrictions, Royalty Payments, Compliance and Regulatory Requirements, Termination Conditions"
Maintenance Agreement,Telecommunications,"Maintenance Services for Telecommunication Equipment, Facility Maintenance Contracts, Service Agreements for Telecommunication Infrastructure"
Memorandum of Understanding (MOU),Telecommunications,"Preliminary Agreements for Telecommunications Partnerships, Intentions for Collaborative Projects, Frameworks for Joint Ventures"
Non-Disclosure Agreement (NDA),Telecommunications,"Protection of Intellectual Property, Technology Assessment, Compliance and Regulatory Requirements, Vendor Selection Process, Investor Discussions, Partnership Discussions"
Partnership Agreement,Telecommunications,"Revenue Sharing Arrangements, Governance Structure, Decision-Making Processes, Roles and Responsibilities, Dispute Resolution Mechanisms, Exit Strategies"
Purchase Agreement,Telecommunications,"Procurement of Telecommunication Equipment, Purchase of Telecommunication Services, Acquisition of Telecommunications Businesses or Assets"
Reseller Agreement,Telecommunications,"Distribution Agreements for Telecommunication Products, Reselling Telecommunication Services, Partnerships with Distributors"
Service Agreement,Telecommunications,"Service Level Agreements for Telecommunication Services, Scope of Services, Pricing Structure, Performance Metrics, Termination Conditions, Intellectual Property Rights"
Supplier Agreement,Telecommunications,"Quality Standards for Telecommunication Products, Delivery Schedules, Pricing Structure, Payment Terms, Product Specifications, Termination Conditions"
Vendor Agreement,Telecommunications,"Service Level Agreements with Telecommunication Vendors, Pricing Structure, Performance Metrics, Termination Conditions, Delivery Schedules, Intellectual Property Rights"
RFI (Request for Information),Telecommunications,"Vendor Selection Process, Technology Assessment, Compliance and Regulatory Requirements, Market Research, Partnership Discussions, Risk Management"
RFQ (Request for Quotation),Telecommunications,"Vendor Selection Process, Pricing Comparison, Budget Planning, Supplier Evaluation, Product or Service Specifications, Risk Management"
RFP (Request for Proposal),Telecommunications,"Vendor Selection Process, Project Scope and Objectives, Budget Planning, Service Level Agreements, Deliverables, Risk Management"
Advertising Agreement,Real Estate,"Marketing Strategies, Promotion of Real Estate Properties, Advertising Campaigns, Branding Initiatives, Sponsorship Agreements"
Barter Agreement,Real Estate,"Exchange of Real Estate Properties or Services, Partnerships with Suppliers, Bartering Property or Services"
Bill of Sale,Real Estate,"Transfer of Ownership of Real Estate Properties, Transaction Records for Real Estate Assets"
Collaboration Agreement,Real Estate,"Partnerships with Other Real Estate Companies, Joint Ventures, Collaborative Marketing Campaigns, Property Development Projects"
Confidentiality Agreement (NDA),Real Estate,"Protection of Intellectual Property, Technology Assessment, Compliance and Regulatory Requirements, Vendor Selection Process, Investor Discussions, Partnership Discussions"
Consulting Agreement,Real Estate,"Real Estate Consultation Services, Technology Assessment, Compliance and Regulatory Requirements, Service Level Agreements, Project Scope and Objectives, Compensation Terms"
Distribution Agreement,Real Estate,"Property Distribution Strategies, Geographic Reach, Revenue Sharing Arrangements, Performance Metrics, Termination Conditions, Exclusive Rights"
Employment Agreement,Real Estate,"Hiring Process, Employee Responsibilities in Real Estate Agencies, Compensation and Benefits, Non-Compete Agreements, Confidentiality Obligations, Termination Conditions"
Equipment Lease Agreement,Real Estate,"Leasing of Equipment for Real Estate Operations, Facilities Management Contracts, Temporary Equipment Arrangements"
Franchise Agreement,Real Estate,"Franchising Real Estate Services, Licensing of Real Estate Brands, Expansion of Real Estate Agencies"
Independent Contractor Agreement,Real Estate,"Hiring of Independent Contractors for Real Estate Projects, Consultation Services, Temporary Staffing Arrangements"
Joint Venture Agreement,Real Estate,"Property Development Projects, Revenue Sharing Arrangements, Governance Structure, Decision-Making Processes, Exit Strategies, Intellectual Property Rights"
Lease Agreement,Real Estate,"Leasing of Real Estate Properties, Rental Contracts for Residential or Commercial Spaces, Leasing of Land for Real Estate Development"
Maintenance Agreement,Real Estate,"Property Maintenance Services, Facility Maintenance Contracts, Service Agreements for Real Estate Properties"
Memorandum of Understanding (MOU),Real Estate,"Preliminary Agreements for Real Estate Partnerships, Intentions for Collaborative Projects, Frameworks for Joint Ventures"
Non-Disclosure Agreement (NDA),Real Estate,"Protection of Intellectual Property, Technology Assessment, Compliance and Regulatory Requirements, Vendor Selection Process, Investor Discussions, Partnership Discussions"
Partnership Agreement,Real Estate,"Revenue Sharing Arrangements, Governance Structure, Decision-Making Processes, Roles and Responsibilities, Dispute Resolution Mechanisms, Exit Strategies"
Purchase Agreement,Real Estate,"Procurement of Real Estate Properties, Purchase of Residential or Commercial Real Estate, Acquisition of Real Estate Businesses or Assets"
Reseller Agreement,Real Estate,"Distribution Agreements for Real Estate Products, Reselling Real Estate Services, Partnerships with Distributors"
Service Agreement,Real Estate,"Property Management Services, Service Level Agreements for Real Estate Services, Scope of Services, Pricing Structure, Performance Metrics, Termination Conditions, Intellectual Property Rights"
Sublease Agreement,Real Estate,"Subleasing of Real Estate Properties or Office Spaces, Subcontracting Services, Rental Agreements for Real Estate Properties"
Supplier Agreement,Real Estate,"Quality Standards for Real Estate Products, Delivery Schedules, Pricing Structure, Payment Terms, Product Specifications, Termination Conditions"
Vendor Agreement,Real Estate,"Service Level Agreements with Real Estate Vendors, Pricing Structure, Performance Metrics, Termination Conditions, Delivery Schedules, Intellectual Property Rights"
Advertising Agreement,Hospitality,"Marketing Strategies, Promotion of Hospitality Services, Advertising Campaigns, Branding Initiatives, Sponsorship Agreements"
Barter Agreement,Hospitality,"Exchange of Hospitality Services or Goods, Partnerships with Suppliers, Bartering Services or Products"
Collaboration Agreement,Hospitality,"Partnerships with Other Hospitality Businesses, Joint Ventures, Collaborative Marketing Campaigns, Service Development Projects"
Confidentiality Agreement (NDA),Hospitality,"Protection of Intellectual Property, Technology Assessment, Compliance and Regulatory Requirements, Vendor Selection Process, Investor Discussions, Partnership Discussions"
Consulting Agreement,Hospitality,"Hospitality Consultation Services, Technology Assessment, Compliance and Regulatory Requirements, Service Level Agreements, Project Scope and Objectives, Compensation Terms"
Distribution Agreement,Hospitality,"Product Distribution Strategies, Geographic Reach, Revenue Sharing Arrangements, Performance Metrics, Termination Conditions, Exclusive Rights"
Employment Agreement,Hospitality,"Hiring Process, Employee Responsibilities in Hospitality, Compensation and Benefits, Non-Compete Agreements, Confidentiality Obligations, Termination Conditions"
Equipment Lease Agreement,Hospitality,"Leasing of Equipment for Hospitality Operations, Facilities Management Contracts, Temporary Equipment Arrangements"
Franchise Agreement,Hospitality,"Franchising Hospitality Services, Licensing of Hospitality Brands, Expansion of Hospitality Operations"
Independent Contractor Agreement,Hospitality,"Hiring of Independent Contractors for Hospitality Projects, Consultation Services, Temporary Staffing Arrangements"
Joint Venture Agreement,Hospitality,"Hospitality Development Projects, Revenue Sharing Arrangements, Governance Structure, Decision-Making Processes, Exit Strategies, Intellectual Property Rights"
Lease Agreement,Hospitality,"Leasing of Hospitality Properties, Rental Contracts for Hotels or Restaurants, Leasing of Land for Hospitality Development"
Maintenance Agreement,Hospitality,"Property Maintenance Services, Facility Maintenance Contracts, Service Agreements for Hospitality Properties"
Memorandum of Understanding (MOU),Hospitality,"Preliminary Agreements for Hospitality Partnerships, Intentions for Collaborative Projects, Frameworks for Joint Ventures"
Non-Disclosure Agreement (NDA),Hospitality,"Protection of Intellectual Property, Technology Assessment, Compliance and Regulatory Requirements, Vendor Selection Process, Investor Discussions, Partnership Discussions"
Partnership Agreement,Hospitality,"Revenue Sharing Arrangements, Governance Structure, Decision-Making Processes, Roles and Responsibilities, Dispute Resolution Mechanisms, Exit Strategies"
Purchase Agreement,Hospitality,"Procurement of Hospitality Properties, Purchase of Hospitality Services, Acquisition of Hospitality Businesses or Assets"
Reseller Agreement,Hospitality,"Distribution Agreements for Hospitality Products, Reselling Hospitality Services, Partnerships with Distributors"
Service Agreement,Hospitality,"Hospitality Service Level Agreements, Scope of Services, Pricing Structure, Performance Metrics, Termination Conditions, Intellectual Property Rights"
Sublease Agreement,Hospitality,"Subleasing of Hospitality Properties or Spaces, Subcontracting Services, Rental Agreements for Hospitality Properties"
Supplier Agreement,Hospitality,"Quality Standards for Hospitality Products, Delivery Schedules, Pricing Structure, Payment Terms, Product Specifications, Termination Conditions"
Vendor Agreement,Hospitality,"Service Level Agreements with Hospitality Vendors, Pricing Structure, Performance Metrics, Termination Conditions, Delivery Schedules, Intellectual Property Rights"
Collaboration Agreement,Education,"Partnerships with Other Educational Institutions, Joint Ventures, Collaborative Programs, Research Projects"
Confidentiality Agreement (NDA),Education,"Protection of Intellectual Property, Technology Assessment, Compliance and Regulatory Requirements, Vendor Selection Process, Investor Discussions, Partnership Discussions"
Consulting Agreement,Education,"Educational Consulting Services, Technology Assessment, Compliance and Regulatory Requirements, Service Level Agreements, Project Scope and Objectives, Compensation Terms"
Employment Agreement,Education,"Hiring Process, Employee Responsibilities in Educational Institutions, Compensation and Benefits, Non-Compete Agreements, Confidentiality Obligations, Termination Conditions"
Franchise Agreement,Education,"Franchising Educational Services, Licensing of Educational Brands, Expansion of Educational Programs"
Independent Contractor Agreement,Education,"Hiring of Independent Contractors for Educational Projects, Consultation Services, Temporary Staffing Arrangements"
Joint Venture Agreement,Education,"Educational Development Projects, Revenue Sharing Arrangements, Governance Structure, Decision-Making Processes, Exit Strategies, Intellectual Property Rights"
Lease Agreement,Education,"Leasing of Educational Facilities, Rental Contracts for Schools or Colleges, Leasing of Land for Educational Development"
Maintenance Agreement,Education,"Property Maintenance Services for Educational Facilities, Facility Maintenance Contracts, Service Agreements"
Memorandum of Understanding (MOU),Education,"Preliminary Agreements for Educational Partnerships, Intentions for Collaborative Projects, Frameworks for Joint Ventures"
Non-Disclosure Agreement (NDA),Education,"Protection of Intellectual Property, Technology Assessment, Compliance and Regulatory Requirements, Vendor Selection Process, Investor Discussions, Partnership Discussions"
Partnership Agreement,Education,"Revenue Sharing Arrangements, Governance Structure, Decision-Making Processes, Roles and Responsibilities, Dispute Resolution Mechanisms, Exit Strategies"
Purchase Agreement,Education,"Procurement of Educational Materials, Purchase of Educational Services, Acquisition of Educational Businesses or Assets"
Reseller Agreement,Education,"Distribution Agreements for Educational Products, Reselling Educational Services, Partnerships with Distributors"
Service Agreement,Education,"Educational Service Level Agreements, Scope of Services, Pricing Structure, Performance Metrics, Termination Conditions, Intellectual Property Rights"
Supplier Agreement,Education,"Quality Standards for Educational Products, Delivery Schedules, Pricing Structure, Payment Terms, Product Specifications, Termination Conditions"
Vendor Agreement,Education,"Service Level Agreements with Educational Vendors, Pricing Structure, Performance Metrics, Termination Conditions, Delivery Schedules, Intellectual Property Rights"
Document,Domain,Key_Aspects
Business Loan Agreement,Education,"Financing for Educational Institutions, Expansion Projects, Acquisition of Educational Equipment or Resources, Operating Capital"
Collaboration Agreement,Education,"Partnerships with Other Educational Institutions, Joint Ventures, Collaborative Programs, Research Projects"
Confidentiality Agreement (NDA),Education,"Protection of Intellectual Property, Technology Assessment, Compliance and Regulatory Requirements, Vendor Selection Process, Investor Discussions, Partnership Discussions"
Consulting Agreement,Education,"Educational Consulting Services, Technology Assessment, Compliance and Regulatory Requirements, Service Level Agreements, Project Scope and Objectives, Compensation Terms"
