Document,Domain,Key_Aspects
Distribution Agreement,Education,"Product Distribution Strategies for Educational Materials, Geographic Reach, Revenue Sharing Arrangements, Performance Metrics"
Employment Agreement,Education,"Hiring Process, Employee Responsibilities in Educational Institutions, Compensation and Benefits, Non-Compete Agreements, Confidentiality Obligations, Termination Conditions"
Equipment Lease Agreement,Education,"Leasing of Equipment for Educational Purposes, Facilities Management Contracts, Temporary Equipment Arrangements"
Joint Venture Agreement,Education,"Educational Development Projects, Revenue Sharing Arrangements, Governance Structure, Decision-Making Processes, Exit Strategies, Intellectual Property Rights"
Lease Agreement,Education,"Leasing of Educational Facilities, Rental Contracts for Schools or Colleges, Leasing of Land for Educational Development"
Maintenance Agreement,Education,"Property Maintenance Services for Educational Facilities, Facility Maintenance Contracts, Service Agreements"
Memorandum of Understanding (MOU),Education,"Preliminary Agreements for Educational Partnerships, Intentions for Collaborative Projects, Frameworks for Joint Ventures"
Non-Disclosure Agreement (NDA),Education,"Protection of Intellectual Property, Technology Assessment, Compliance and Regulatory Requirements, Vendor Selection Process, Investor Discussions, Partnership Discussions"
Partnership Agreement,Education,"Revenue Sharing Arrangements, Governance Structure, Decision-Making Processes, Roles and Responsibilities, Dispute Resolution Mechanisms, Exit Strategies"
Purchase Agreement,Education,"Procurement of Educational Materials, Purchase of Educational Services, Acquisition of Educational Businesses or Assets"
Reseller Agreement,Education,"Distribution Agreements for Educational Products, Reselling Educational Services, Partnerships with Distributors"
Service Agreement,Education,"Educational Service Level Agreements, Scope of Services, Pricing Structure, Performance Metrics, Termination Conditions, Intellectual Property Rights"
Supplier Agreement,Education,"Quality Standards for Educational Products, Delivery Schedules, Pricing Structure, Payment Terms, Product Specifications, Termination Conditions"
Vendor Agreement,Education,"Service Level Agreements with Educational Vendors, Pricing Structure, Performance Metrics, Termination Conditions, Delivery Schedules, Intellectual Property Rights"
Barter Agreement,Transportation and Logistics,"Exchange of Services or Goods, Partnerships with Suppliers, Bartering Services or Products"
Bill of Sale,Transportation and Logistics,"Transfer of Ownership of Assets, Purchase of Vehicles or Equipment, Transaction Records"
Business Loan Agreement,Transportation and Logistics,"Financing for Transportation and Logistics Companies, Expansion Projects, Acquisition of Vehicles or Equipment, Operating Capital"
Collaboration Agreement,Transportation and Logistics,"Partnerships with Other Companies, Joint Ventures, Collaborative Projects, Research and Development Agreements"
Confidentiality Agreement (NDA),Transportation and Logistics,"Protection of Intellectual Property, Technology Assessment, Compliance and Regulatory Requirements, Vendor Selection Process, Investor Discussions, Partnership Discussions"
Consulting Agreement,Transportation and Logistics,"Consulting Services for Transportation and Logistics, Technology Assessment, Compliance and Regulatory Requirements, Service Level Agreements"
Distribution Agreement,Transportation and Logistics,"Product Distribution Strategies, Geographic Reach, Revenue Sharing Arrangements, Performance Metrics"
Employment Agreement,Transportation and Logistics,"Hiring Process, Employee Responsibilities, Compensation and Benefits, Non-Compete Agreements, Confidentiality Obligations"
Equipment Lease Agreement,Transportation and Logistics,"Leasing of Equipment for Transportation and Logistics Operations, Facilities Management Contracts, Temporary Equipment Arrangements"
Independent Contractor Agreement,Transportation and Logistics,"Hiring of Independent Contractors for Transportation and Logistics Projects, Consultation Services, Temporary Staffing Arrangements"
Joint Venture Agreement,Transportation and Logistics,"Development Projects, Revenue Sharing Arrangements, Governance Structure, Decision-Making Processes, Exit Strategies"
Lease Agreement,Transportation and Logistics,"Leasing of Properties or Equipment for Transportation and Logistics, Rental Contracts, Leasing of Land for Facilities"
Maintenance Agreement,Transportation and Logistics,"Maintenance Services for Transportation and Logistics Assets, Facility Maintenance Contracts, Service Agreements"
Memorandum of Understanding (MOU),Transportation and Logistics,"Preliminary Agreements, Intentions for Collaborative Projects, Frameworks for Joint Ventures"
Non-Disclosure Agreement (NDA),Transportation and Logistics,"Protection of Intellectual Property, Technology Assessment, Compliance and Regulatory Requirements, Vendor Selection Process, Investor Discussions, Partnership Discussions"
Partnership Agreement,Transportation and Logistics,"Revenue Sharing Arrangements, Governance Structure, Decision-Making Processes, Roles and Responsibilities, Dispute Resolution Mechanisms"
Purchase Agreement,Transportation and Logistics,"Procurement of Materials or Equipment, Purchase of Vehicles, Acquisition of Transportation and Logistics Businesses or Assets"
Reseller Agreement,Transportation and Logistics,"Distribution Agreements, Reselling Services or Products, Partnerships with Distributors"
Service Agreement,Transportation and Logistics,"Service Level Agreements, Scope of Services, Pricing Structure, Performance Metrics, Termination Conditions"
Supplier Agreement,Transportation and Logistics,"Quality Standards, Delivery Schedules, Pricing Structure, Payment Terms, Product Specifications, Termination Conditions"
Vendor Agreement,Transportation and Logistics,"Service Level Agreements with Vendors, Pricing Structure, Performance Metrics, Termination Conditions"
Advertising Agreement,Media and Entertainment,"Advertising Partnerships, Marketing Strategies, Promotion of Media Products, Revenue Sharing Arrangements, Performance Metrics"
Agency Agreement,Media and Entertainment,"Partnerships with Talent Agencies, Talent Representation, Commission Agreements, Performance Metrics"
Collaboration Agreement,Media and Entertainment,"Partnerships with Other Media Companies, Joint Ventures, Collaborative Projects, Content Creation Agreements"
Confidentiality Agreement (NDA),Media and Entertainment,"Protection of Intellectual Property, Technology Assessment, Compliance and Regulatory Requirements, Vendor Selection Process, Investor Discussions, Partnership Discussions"
Consulting Agreement,Media and Entertainment,"Consulting Services for Media and Entertainment, Technology Assessment, Compliance and Regulatory Requirements, Service Level Agreements"
Distribution Agreement,Media and Entertainment,"Content Distribution Strategies, Geographic Reach, Revenue Sharing Arrangements, Performance Metrics"
Employment Agreement,Media and Entertainment,"Hiring Process, Employee Responsibilities, Compensation and Benefits, Non-Compete Agreements, Confidentiality Obligations"
Equipment Lease Agreement,Media and Entertainment,"Leasing of Equipment for Media Production, Facilities Management Contracts, Temporary Equipment Arrangements"
Franchise Agreement,Media and Entertainment,"Franchising Media Brands, Licensing Agreements, Expansion of Media Products or Services"
Independent Contractor Agreement,Media and Entertainment,"Hiring of Independent Contractors for Media Projects, Content Creation Services, Temporary Staffing Arrangements"
Joint Venture Agreement,Media and Entertainment,"Development Projects, Revenue Sharing Arrangements, Governance Structure, Decision-Making Processes, Exit Strategies"
Licensing Agreement,Media and Entertainment,"Licensing of Intellectual Property, Usage Rights, Royalty Payments, Compliance and Regulatory Requirements"
Maintenance Agreement,Media and Entertainment,"Maintenance Services for Media Equipment, Facility Maintenance Contracts, Service Agreements"
Memorandum of Understanding (MOU),Media and Entertainment,"Preliminary Agreements, Intentions for Collaborative Projects, Frameworks for Joint Ventures"
Non-Disclosure Agreement (NDA),Media and Entertainment,"Protection of Intellectual Property, Technology Assessment, Compliance and Regulatory Requirements, Vendor Selection Process, Investor Discussions, Partnership Discussions"
Partnership Agreement,Media and Entertainment,"Revenue Sharing Arrangements, Governance Structure, Decision-Making Processes, Roles and Responsibilities, Dispute Resolution Mechanisms"
Purchase Agreement,Media and Entertainment,"Procurement of Media Materials or Equipment, Purchase of Intellectual Property Rights, Acquisition of Media Businesses or Assets"
Reseller Agreement,Media and Entertainment,"Distribution Agreements for Media Products, Reselling Media Services, Partnerships with Distributors"
Service Agreement,Media and Entertainment,"Service Level Agreements for Media Services, Scope of Services, Pricing Structure, Performance Metrics, Termination Conditions"
Supplier Agreement,Media and Entertainment,"Quality Standards for Media Products, Delivery Schedules, Pricing Structure, Payment Terms, Product Specifications"
Vendor Agreement,Media and Entertainment,"Service Level Agreements with Media Vendors, Pricing Structure, Performance Metrics, Termination Conditions"
Advertising Agreement,Retail,"Advertising Partnerships, Marketing Strategies, Promotion of Retail Products, Revenue Sharing Arrangements, Performance Metrics"
Barter Agreement,Retail,"Exchange of Goods or Services, Partnerships with Suppliers, Bartering Products or Services"
Bill of Sale,Retail,"Transfer of Ownership of Assets, Purchase of Retail Goods or Equipment, Transaction Records"
Business Loan Agreement,Retail,"Financing for Retail Operations, Expansion Projects, Acquisition of Retail Inventory or Equipment, Operating Capital"
Collaboration Agreement,Retail,"Partnerships with Other Retail Companies, Joint Ventures, Collaborative Projects, Marketing Campaigns"
Confidentiality Agreement (NDA),Retail,"Protection of Intellectual Property, Technology Assessment, Compliance and Regulatory Requirements, Vendor Selection Process, Investor Discussions, Partnership Discussions"
Consulting Agreement,Retail,"Consulting Services for Retail Operations, Technology Assessment, Compliance and Regulatory Requirements, Service Level Agreements"
Distribution Agreement,Retail,"Product Distribution Strategies, Geographic Reach, Revenue Sharing Arrangements, Performance Metrics"
Employment Agreement,Retail,"Hiring Process, Employee Responsibilities, Compensation and Benefits, Non-Compete Agreements, Confidentiality Obligations"
Equipment Lease Agreement,Retail,"Leasing of Equipment for Retail Operations, Facilities Management Contracts, Temporary Equipment Arrangements"
Franchise Agreement,Retail,"Franchising Retail Brands, Licensing Agreements, Expansion of Retail Stores or Services"
Independent Contractor Agreement,Retail,"Hiring of Independent Contractors for Retail Projects, Consultation Services, Temporary Staffing Arrangements"
Joint Venture Agreement,Retail,"Development Projects, Revenue Sharing Arrangements, Governance Structure, Decision-Making Processes, Exit Strategies"
Lease Agreement,Retail,"Leasing of Retail Properties, Rental Contracts, Leasing of Land for Stores or Facilities"
Maintenance Agreement,Retail,"Maintenance Services for Retail Equipment, Facility Maintenance Contracts, Service Agreements"
Memorandum of Understanding (MOU),Retail,"Preliminary Agreements, Intentions for Collaborative Projects, Frameworks for Joint Ventures"
Non-Compete Agreement,Retail,"Restricting Competition Among Retail Companies, Non-Compete Clauses in Employment Contracts, Protection of Intellectual Property"
Non-Disclosure Agreement (NDA),Retail,"Protection of Intellectual Property, Technology Assessment, Compliance and Regulatory Requirements, Vendor Selection Process, Investor Discussions, Partnership Discussions"
Partnership Agreement,Retail,"Revenue Sharing Arrangements, Governance Structure, Decision-Making Processes, Roles and Responsibilities, Dispute Resolution Mechanisms"
Purchase Agreement,Retail,"Procurement of Retail Goods or Equipment, Purchase of Inventory, Acquisition of Retail Businesses or Assets"
Reseller Agreement,Retail,"Distribution Agreements for Retail Products, Reselling Retail Services or Products, Partnerships with Distributors"
Service Agreement,Retail,"Service Level Agreements for Retail Services, Scope of Services, Pricing Structure, Performance Metrics"
Supplier Agreement,Retail,"Quality Standards for Retail Products, Delivery Schedules, Pricing Structure, Payment Terms, Product Specifications"
Vendor Agreement,Retail,"Service Level Agreements with Vendors, Pricing Structure, Performance Metrics, Termination Conditions"
Document,Domain,Key_Aspects
Barter Agreement,Manufacturing,"Exchange of Goods or Services, Partnerships with Suppliers, Bartering Products or Services"
Bill of Sale,Manufacturing,"Transfer of Ownership of Assets, Purchase of Manufacturing Goods or Equipment, Transaction Records"
Business Loan Agreement,Manufacturing,"Financing for Manufacturing Operations, Expansion Projects, Acquisition of Manufacturing Inventory or Equipment, Operating Capital"
Collaboration Agreement,Manufacturing,"Partnerships with Other Manufacturing Companies, Joint Ventures, Collaborative Projects, Research and Development Agreements"
Confidentiality Agreement (NDA),Manufacturing,"Protection of Intellectual Property, Technology Assessment, Compliance and Regulatory Requirements, Vendor Selection Process, Partnership Discussions"
Consulting Agreement,Manufacturing,"Consulting Services for Manufacturing Operations, Technology Assessment, Compliance and Regulatory Requirements, Service Level Agreements"
Distribution Agreement,Manufacturing,"Product Distribution Strategies, Geographic Reach, Revenue Sharing Arrangements, Performance Metrics"
Employment Agreement,Manufacturing,"Hiring Process, Employee Responsibilities, Compensation and Benefits, Non-Compete Agreements, Confidentiality Obligations"
Equipment Lease Agreement,Manufacturing,"Leasing of Equipment for Manufacturing Operations, Facilities Management Contracts, Temporary Equipment Arrangements"
Franchise Agreement,Manufacturing,"Franchising Manufacturing Brands, Licensing Agreements, Expansion of Manufacturing Facilities"
Independent Contractor Agreement,Manufacturing,"Hiring of Independent Contractors for Manufacturing Projects, Consultation Services, Temporary Staffing Arrangements"
Joint Venture Agreement,Manufacturing,"Development Projects, Revenue Sharing Arrangements, Governance Structure, Decision-Making Processes, Exit Strategies"
Lease Agreement,Manufacturing,"Leasing of Manufacturing Properties, Rental Contracts, Leasing of Land for Manufacturing Facilities"
Maintenance Agreement,Manufacturing,"Maintenance Services for Manufacturing Equipment, Facility Maintenance Contracts, Service Agreements"
Memorandum of Understanding (MOU),Manufacturing,"Preliminary Agreements, Intentions for Collaborative Projects, Frameworks for Joint Ventures"
Non-Compete Agreement,Manufacturing,"Restricting Competition Among Manufacturing Companies, Non-Compete Clauses in Employment Contracts, Protection of Intellectual Property"
Non-Disclosure Agreement (NDA),Manufacturing,"Protection of Intellectual Property, Technology Assessment, Compliance and Regulatory Requirements, Vendor Selection Process, Partnership Discussions"
Partnership Agreement,Manufacturing,"Revenue Sharing Arrangements, Governance Structure, Decision-Making Processes, Roles and Responsibilities, Dispute Resolution Mechanisms"
Purchase Agreement,Manufacturing,"Procurement of Manufacturing Goods or Equipment, Purchase of Inventory, Acquisition of Manufacturing Businesses or Assets"
Reseller Agreement,Manufacturing,"Distribution Agreements for Manufacturing Products, Reselling Manufacturing Services or Products, Partnerships with Distributors"
Service Agreement,Manufacturing,"Service Level Agreements for Manufacturing Services, Scope of Services, Pricing Structure, Performance Metrics"
Supplier Agreement,Manufacturing,"Quality Standards for Manufacturing Products, Delivery Schedules, Pricing Structure, Payment Terms, Product Specifications"
Vendor Agreement,Manufacturing,"Service Level Agreements with Vendors, Pricing Structure, Performance Metrics, Termination Conditions"
Manufacturing Agreement,Manufacturing,"Agreements for Manufacturing Services, Product Specifications, Quality Control Measures, Delivery Schedules"
Business Loan Agreement,Financial Services,"Loan Terms and Conditions, Interest Rates, Repayment Schedules, Collateral Requirements, Default Provisions, Prepayment Penalties"
Collaboration Agreement,Financial Services,"Partnerships with Other Financial Institutions, Joint Ventures, Collaborative Projects, Research and Development Agreements"
Confidentiality Agreement (NDA),Financial Services,"Protection of Intellectual Property, Technology Assessment, Compliance and Regulatory Requirements, Vendor Selection Process, Partnership Discussions"
Consulting Agreement,Financial Services,"Consulting Services for Financial Operations, Technology Assessment, Compliance and Regulatory Requirements, Service Level Agreements"
Employment Agreement,Financial Services,"Hiring Process, Employee Responsibilities, Compensation and Benefits, Non-Compete Agreements, Confidentiality Obligations"
Franchise Agreement,Financial Services,"Franchising Financial Brands, Licensing Agreements, Expansion of Financial Services"
Independent Contractor Agreement,Financial Services,"Hiring of Independent Contractors for Financial Projects, Consultation Services, Temporary Staffing Arrangements"
Joint Venture Agreement,Financial Services,"Development Projects, Revenue Sharing Arrangements, Governance Structure, Decision-Making Processes, Exit Strategies"
Lease Agreement,Financial Services,"Leasing of Office Spaces for Financial Operations, Rental Contracts, Leasing of Land for Financial Facilities"
Licensing Agreement,Financial Services,"Licensing of Financial Products, Technology Transfer, Usage Restrictions, Royalty Payments, Compliance and Regulatory Requirements"
Loan Agreement,Financial Services,"Loan Terms and Conditions, Interest Rates, Repayment Schedules, Collateral Requirements, Default Provisions, Prepayment Penalties"
Maintenance Agreement,Financial Services,"Maintenance Services for Financial Equipment, Facility Maintenance Contracts, Service Agreements"
Memorandum of Understanding (MOU),Financial Services,"Preliminary Agreements, Intentions for Collaborative Projects, Frameworks for Joint Ventures"
Non-Compete Agreement,Financial Services,"Restricting Competition Among Financial Institutions, Non-Compete Clauses in Employment Contracts, Protection of Intellectual Property"
Non-Disclosure Agreement (NDA),Financial Services,"Protection of Intellectual Property, Technology Assessment, Compliance and Regulatory Requirements, Vendor Selection Process, Partnership Discussions"
Partnership Agreement,Financial Services,"Revenue Sharing Arrangements, Governance Structure, Decision-Making Processes, Roles and Responsibilities, Dispute Resolution Mechanisms"
Purchase Agreement,Financial Services,"Procurement of Financial Assets, Purchase of Financial Products, Acquisition of Financial Businesses or Assets"
Reseller Agreement,Financial Services,"Distribution Agreements for Financial Products, Reselling Financial Services or Products, Partnerships with Distributors"
Service Agreement,Financial Services,"Service Level Agreements for Financial Services, Scope of Services, Pricing Structure, Performance Metrics"
Shareholder Agreement,Financial Services,"Equity Ownership, Voting Rights, Dividend Distribution, Board Representation, Transfer Restrictions, Exit Strategies"
Sublease Agreement,Financial Services,"Subleasing of Office Spaces for Financial Operations, Subcontracting Services, Rental Agreements"
Supplier Agreement,Financial Services,"Quality Standards for Financial Products, Delivery Schedules, Pricing Structure, Payment Terms, Product Specifications"
Vendor Agreement,Financial Services,"Service Level Agreements with Vendors, Pricing Structure, Performance Metrics, Termination Conditions"
RFI,Financial Services,"Vendor Selection Process, Technology Assessment, Compliance and Regulatory Requirements, Market Research, Partnership Discussions, Risk Management"
RFQ,Financial Services,"Vendor Selection Process, Pricing Comparison, Budget Planning, Supplier Evaluation, Product or Service Specifications, Risk Management"
RFP,Financial Services,"Vendor Selection Process, Project Scope and Objectives, Budget Planning, Service Level Agreements, Deliverables, Risk Management"
Collaboration Agreement,Technology,"Partnerships with Other Technology Companies, Joint Ventures, Collaborative Projects, Research and Development Agreements"
Confidentiality Agreement (NDA),Technology,"Protection of Intellectual Property, Technology Assessment, Compliance and Regulatory Requirements, Vendor Selection Process, Partnership Discussions"
Consulting Agreement,Technology,"Consulting Services for Technology Operations, Technology Assessment, Compliance and Regulatory Requirements, Service Level Agreements"
Distribution Agreement,Technology,"Product Distribution Strategies, Geographic Reach, Revenue Sharing Arrangements, Performance Metrics"
Employment Agreement,Technology,"Hiring Process, Employee Responsibilities, Compensation and Benefits, Non-Compete Agreements, Confidentiality Obligations"
Equipment Lease Agreement,Technology,"Leasing of Equipment for Technology Operations, Facilities Management Contracts, Temporary Equipment Arrangements"
Franchise Agreement,Technology,"Franchising Technology Brands, Licensing Agreements, Expansion of Technology Services"
Independent Contractor Agreement,Technology,"Hiring of Independent Contractors for Technology Projects, Consultation Services, Temporary Staffing Arrangements"
Joint Venture Agreement,Technology,"Development Projects, Revenue Sharing Arrangements, Governance Structure, Decision-Making Processes, Exit Strategies"
Lease Agreement,Technology,"Leasing of Office Spaces for Technology Operations, Rental Contracts, Leasing of Land for Technology Facilities"
Licensing Agreement,Technology,"Licensing of Technology Products, Technology Transfer, Usage Restrictions, Royalty Payments, Compliance and Regulatory Requirements"
Maintenance Agreement,Technology,"Maintenance Services for Technology Equipment, Facility Maintenance Contracts, Service Agreements"
Memorandum of Understanding (MOU),Technology,"Preliminary Agreements, Intentions for Collaborative Projects, Frameworks for Joint Ventures"
Non-Compete Agreement,Technology,"Restricting Competition Among Technology Companies, Non-Compete Clauses in Employment Contracts, Protection of Intellectual Property"
Non-Disclosure Agreement (NDA),Technology,"Protection of Intellectual Property, Technology Assessment, Compliance and Regulatory Requirements, Vendor Selection Process, Partnership Discussions"
Partnership Agreement,Technology,"Revenue Sharing Arrangements, Governance Structure, Decision-Making Processes, Roles and Responsibilities, Dispute Resolution Mechanisms"
Purchase Agreement,Technology,"Procurement of Technology Assets, Purchase of Technology Products, Acquisition of Technology Businesses or Assets"
Reseller Agreement,Technology,"Distribution Agreements for Technology Products, Reselling Technology Services or Products, Partnerships with Distributors"
Service Agreement,Technology,"Service Level Agreements for Technology Services, Scope of Services, Pricing Structure, Performance Metrics"
Supplier Agreement,Technology,"Quality Standards for Technology Products, Delivery Schedules, Pricing Structure, Payment Terms, Product Specifications"
Vendor Agreement,Technology,"Service Level Agreements with Vendors, Pricing Structure, Performance Metrics, Termination Conditions"
RFI,Technology,"Vendor Selection Process, Technology Assessment, Compliance and Regulatory Requirements, Market Research, Partnership Discussions, Risk Management"
RFQ,Technology,"Vendor Selection Process, Pricing Comparison, Budget Planning, Supplier Evaluation, Product or Service Specifications, Risk Management"
RFP,Technology,"Vendor Selection Process, Project Scope and Objectives, Budget Planning, Service Level Agreements, Deliverables, Risk Management"
Barter Agreement,Agriculture,"Procurement of Agricultural Goods or Services, Partnerships with Suppliers, Bartering Agricultural Products or Services"
Bill of Sale,Agriculture,"Transfer of Ownership of Agricultural Equipment or Supplies, Purchase of Farming Assets, Transaction Records for Agricultural Assets"
Business Loan Agreement,Agriculture,"Financing for Agricultural Operations, Expansion Projects, Acquisition of Farming Equipment, Operating Capital for Farms"
Collaboration Agreement,Agriculture,"Partnerships with Research Institutions, Joint Research and Development Projects, Collaborative Farming Programs"
Confidentiality Agreement (NDA),Agriculture,"Protection of Intellectual Property, Technology Assessment, Compliance and Regulatory Requirements, Vendor Selection Process, Partnership Discussions"
Consulting Agreement,Agriculture,"Consulting Services for Agricultural Operations, Technology Assessment, Compliance and Regulatory Requirements, Service Level Agreements"
Distribution Agreement,Agriculture,"Product Distribution Strategies, Geographic Reach, Revenue Sharing Arrangements, Performance Metrics"
